{
  "$schema":"https://json-schema.org/draft/2020-12/schema","type":"object","additionalProperties":false,
  "required":["version","dataset_card","candidates","splits","query_results","schedules","budgets"],
  "properties":{"version":{"const":1},"dataset_card":{"type":"object","additionalProperties":false,"required":["dataset_id","created_at","synthetic","candidate_ids_fixed_before_runs","test_labels_not_used_for_tuning","split_grouping","limitations"],"properties":{"dataset_id":{"type":"string"},"created_at":{"type":"string","format":"date-time"},"synthetic":{"type":"boolean"},"candidate_ids_fixed_before_runs":{"const":true},"test_labels_not_used_for_tuning":{"const":true},"split_grouping":{"enum":["candidate_id","organization_group"]},"limitations":{"type":"array","minItems":1,"items":{"type":"string"}}}},"candidates":{"type":"array","minItems":1,"items":{"type":"object","additionalProperties":false,"required":["candidate_id","label","families"],"properties":{"candidate_id":{"type":"string"},"label":{"enum":["relevant","known_false_positive","unlabeled_unknown"]},"families":{"type":"array","minItems":1,"uniqueItems":true,"items":{"type":"string"}}}}},"splits":{"type":"object","additionalProperties":false,"required":["train","test"],"properties":{"train":{"type":"array","uniqueItems":true,"items":{"type":"string"}},"test":{"type":"array","uniqueItems":true,"items":{"type":"string"}}}},"query_results":{"type":"array","minItems":1,"items":{"type":"object","additionalProperties":false,"required":["query_id","family","cost","candidate_ids"],"properties":{"query_id":{"type":"string"},"family":{"type":"string"},"cost":{"type":"integer","minimum":0},"candidate_ids":{"type":"array","uniqueItems":true,"items":{"type":"string"}}}}},"schedules":{"type":"object","additionalProperties":false,"required":["baseline","proposed"],"properties":{"baseline":{"type":"array","uniqueItems":true,"items":{"type":"string"}},"proposed":{"type":"array","uniqueItems":true,"items":{"type":"string"}}}},"budgets":{"type":"array","minItems":1,"uniqueItems":true,"items":{"type":"integer","minimum":0}}}
}
